{
  "module_id": "config.env_resolver",
  "version": "0.1.0",
  "category": "configuration",
  "capability_type": "provider",
  "purpose": "Resolve declared environment variables into typed configuration values with defaults, required checks, and redacted reporting.",
  "reuse_scope": [
    "service startup configuration",
    "local development tooling",
    "test environment setup",
    "desktop application settings"
  ],
  "language": "typescript",
  "runtime": "node",
  "api": {
    "style": "http",
    "base_path": "/api/v1",
    "endpoints": [
      {
        "method": "POST",
        "path": "/config/env/resolve",
        "input_schema": "EnvResolveRequest",
        "output_schema": "EnvResolveResult",
        "description": "Resolve environment variables from a supplied map and schema descriptor."
      }
    ],
    "schemas": {
      "EnvResolveRequest": {
        "type": "object",
        "required": ["spec"],
        "properties": {
          "env": { "type": "object" },
          "spec": {
            "type": "array",
            "items": {
              "type": "object",
              "required": ["name", "type"],
              "properties": {
                "name": { "type": "string" },
                "type": { "type": "string", "enum": ["string", "number", "boolean", "json"] },
                "required": { "type": "boolean" },
                "default": {},
                "secret": { "type": "boolean" }
              }
            }
          }
        }
      },
      "EnvResolveResult": {
        "type": "object",
        "required": ["valid", "values", "errors", "redacted"],
        "properties": {
          "valid": { "type": "boolean" },
          "values": { "type": "object" },
          "errors": { "type": "array", "items": { "type": "string" } },
          "redacted": { "type": "object" }
        }
      }
    }
  },
  "dependencies": [],
  "sidecar_specification": {
    "module_id": "config.env_resolver",
    "version": "0.1.0",
    "purpose": "Typed environment configuration resolver with secret redaction.",
    "agent_usage": {
      "when_to_use": "Use when a service or tool needs to convert raw environment strings into typed configuration values.",
      "when_not_to_use": "Do not use to fetch secrets from remote secret managers or mutate process.env.",
      "example_workflow": "1) Define spec entries with name, type, required, default, and secret. 2) Call /config/env/resolve with env map. 3) Use values internally and redacted for logs."
    },
    "common_calls": [
      {
        "description": "Resolve port and token configuration",
        "method": "POST",
        "path_or_command": "/api/v1/config/env/resolve",
        "input_example": { "env": { "PORT": "3000", "TOKEN": "abc" }, "spec": [{ "name": "PORT", "type": "number", "required": true }, { "name": "TOKEN", "type": "string", "secret": true }] },
        "output_example": { "valid": true, "values": { "PORT": 3000, "TOKEN": "abc" }, "errors": [], "redacted": { "PORT": 3000, "TOKEN": "[redacted]" } }
      }
    ],
    "failure_modes": [
      {
        "condition": "Required variable is missing",
        "symptom": "valid false with missing variable error",
        "recovery": "Provide the variable or define a default",
        "severity": "permanent"
      },
      {
        "condition": "Value cannot be coerced to requested type",
        "symptom": "valid false with type conversion error",
        "recovery": "Fix the raw environment value or requested type",
        "severity": "permanent"
      }
    ],
    "composition_tags": ["config", "environment", "settings", "secrets", "startup"]
  },
  "network_requirements": {
    "requires_network": false,
    "allowed_hosts": [],
    "allow_localhost": true
  },
  "acceptance_gates": [
    "structure_validation",
    "contract_validation",
    "sidecar_validation",
    "unit_tests",
    "contract_tests",
    "docker_tests",
    "write_scope_validation",
    "forbidden_behavior_validation",
    "network_policy_validation",
    "registry_validation"
  ],
  "vm_test_requirements": {
    "dockerfile_required": true,
    "compose_required": true,
    "must_exit_zero": true,
    "extra_services": []
  },
  "forbidden_behaviors": [
    {
      "description": "Must not write outside declared scope",
      "detection_method": "write_scope_check",
      "severity": "critical"
    },
    {
      "description": "Must not make external network calls",
      "detection_method": "network_egress_check",
      "severity": "high"
    },
    {
      "description": "Must not log secret values in redacted output",
      "detection_method": "manual_review",
      "severity": "high"
    }
  ],
  "agent_notes": {
    "implementation_hint": "Resolve from request.env when provided, otherwise process.env. Coerce booleans from true/false/1/0, numbers with Number.isFinite, and json with JSON.parse. Redact secret values in the redacted object only.",
    "known_gotchas": "Empty string may be intentional for string values but invalid for required numbers and booleans. JSON parsing errors must not throw 500.",
    "preferred_approach": "Keep resolution pure by passing env into resolveEnv(spec, env) and using process.env only at the route boundary.",
    "avoid_approach": "Do not mutate process.env, do not read .env files, and do not print secret values."
  },
  "test_cases": [
    {
      "name": "resolve typed values and redact secret",
      "input": { "method": "POST", "path": "/config/env/resolve", "body": { "env": { "PORT": "3000", "SECRET": "abc" }, "spec": [{ "name": "PORT", "type": "number" }, { "name": "SECRET", "type": "string", "secret": true }] } },
      "expected_status": 200,
      "expected_body": { "valid": true, "redacted": { "PORT": 3000, "SECRET": "[redacted]" } }
    }
  ]
}
